food_id,food_name,cuisine,category,calories,protein,carbs,fats,spice_level,veg_nonveg,price,meal_type,image_url,description,ingredients,allergens
f1,Paneer Tikka,Indian,Lunch,320,18,10,22,High,Veg,280,Heavy,https://images.unsplash.com/photo-1567188040759-fb8a883dc6d8?w=600&h=400&fit=crop,Spicy grilled paneer cubes marinated in yogurt and Indian spices. High in protein.,"paneer,yogurt,bell pepper,onion,ginger,garlic,cumin,coriander,turmeric,chili powder,oil",Dairy
f2,Butter Chicken,Indian,Dinner,480,28,12,35,Medium,Non-Veg,380,Heavy,https://images.unsplash.com/photo-1603894584373-5ac82b2ae398?w=600&h=400&fit=crop,Tender chicken in a creamy tomato-based spiced gravy. Ultimate comfort food.,"chicken,butter,cream,tomato,onion,ginger,garlic,cashew,cumin,coriander,turmeric,chili",Dairy|Nuts
f3,Margherita Pizza,Italian,Dinner,350,14,42,13,Low,Veg,320,Heavy,https://images.unsplash.com/photo-1574071318508-1cdbab80d002?w=600&h=400&fit=crop,Classic Italian pizza with fresh tomato sauce and mozzarella.,"flour,yeast,mozzarella,tomato,basil,olive oil,salt",Gluten|Dairy
f4,Chicken Alfredo Pasta,Italian,Dinner,550,26,48,25,Low,Non-Veg,360,Heavy,https://images.unsplash.com/photo-1645112411341-6c4fd023714a?w=600&h=400&fit=crop,Creamy fettuccine in buttery Alfredo sauce with grilled chicken.,"fettuccine,chicken,butter,cream,parmesan,garlic,flour,salt,pepper",Gluten|Dairy
f5,Veg Schezwan Noodles,Chinese,Lunch,380,8,65,10,High,Veg,220,Heavy,https://images.unsplash.com/photo-1569718212165-3a8278d5f624?w=600&h=400&fit=crop,Spicy stir-fried noodles with crunchy vegetables and Schezwan sauce.,"noodles,bell pepper,carrot,cabbage,spring onion,soy sauce,schezwan sauce,garlic,oil",Gluten|Soy
f6,Sushi Combo,Japanese,Dinner,420,22,60,8,Low,Non-Veg,450,Light,https://images.unsplash.com/photo-1579584425555-c3ce17fd4351?w=600&h=400&fit=crop,Assorted fresh sushi rolls with tuna, salmon, and avocado.,"sushi rice,nori,tuna,salmon,avocado,cucumber,soy sauce,wasabi,ginger",Fish|Soy|Sesame
f7,Tofu Veg Stir-Fry,Chinese,Lunch,250,15,20,12,Medium,Veg,240,Light,https://images.unsplash.com/photo-1546069901-ba9599a7e63c?w=600&h=400&fit=crop,Crispy tofu with broccoli and bell peppers in ginger-soy glaze.,"tofu,broccoli,bell pepper,ginger,garlic,soy sauce,sesame oil,cornstarch",Soy|Sesame
f8,Caesar Salad with Chicken,American,Lunch,340,24,12,18,Low,Non-Veg,290,Light,https://images.unsplash.com/photo-1550304943-4f24f54ddde9?w=600&h=400&fit=crop,Romaine lettuce, parmesan, croutons, and grilled chicken with Caesar dressing.,"romaine lettuce,chicken,parmesan,croutons,egg yolk,anchovy,garlic,olive oil,lemon",Gluten|Dairy|Eggs|Fish
f9,Oatmeal with Berries,American,Breakfast,210,6,38,3,Low,Veg,150,Light,https://images.unsplash.com/photo-1517673400267-0251440c45dc?w=600&h=400&fit=crop,Warm rolled oats with fresh strawberries, blueberries, and honey.,"oats,strawberry,blueberry,honey,milk",Dairy
f10,Avocado Toast with Eggs,American,Breakfast,310,12,24,18,Low,Veg,180,Light,https://images.unsplash.com/photo-1525351484163-7529414344d8?w=600&h=400&fit=crop,Toasted sourdough with mashed avocado and poached eggs.,"sourdough bread,avocado,egg,salt,pepper,lemon,chili flakes",Gluten|Eggs
f11,Greek Salad,Italian,Lunch,220,5,10,18,Low,Veg,220,Light,https://images.unsplash.com/photo-1540189549336-e6e99c3679fe?w=600&h=400&fit=crop,Cucumbers, tomatoes, olives, and feta cheese in Greek dressing.,"cucumber,tomato,olive,feta cheese,red onion,olive oil,oregano",Dairy
f12,Taco Fiesta,Mexican,Dinner,410,18,35,16,Medium,Non-Veg,260,Heavy,https://images.unsplash.com/photo-1565299585323-38d6b0865b47?w=600&h=400&fit=crop,Crispy corn tortillas with seasoned beef, lettuce, cheese, and salsa.,"corn tortilla,beef,lettuce,cheddar cheese,tomato,onion,salsa,cumin,chili",Dairy
f13,Chana Masala,Indian,Lunch,280,12,45,6,Medium,Veg,180,Heavy,https://images.unsplash.com/photo-1585937421612-70a008356fbe?w=600&h=400&fit=crop,Chickpea curry in a spiced tomato-onion gravy. High in fiber.,"chickpea,tomato,onion,ginger,garlic,cumin,coriander,turmeric,chili,oil",
f14,Paneer Butter Masala,Indian,Dinner,450,16,14,36,Medium,Veg,290,Heavy,https://images.unsplash.com/photo-1631452180519-c014fe946bc7?w=600&h=400&fit=crop,Cottage cheese curry in a tomato-butter-cashew gravy.,"paneer,butter,cream,tomato,cashew,onion,ginger,garlic,cumin,fenugreek",Dairy|Nuts
f15,Masala Dosa,Indian,Breakfast,320,6,54,8,Medium,Veg,120,Light,https://images.unsplash.com/photo-1610192244261-3f33de3f55e4?w=600&h=400&fit=crop,Crispy rice-lentil crepe stuffed with spiced potato mash.,"rice,urad dal,potato,mustard seeds,curry leaves,turmeric,onion,oil",
f16,Dal Tadka & Rice,Indian,Lunch,340,10,58,5,Medium,Veg,140,Heavy,https://images.unsplash.com/photo-1596797038530-2c107229654b?w=600&h=400&fit=crop,Yellow lentil soup tempered with ghee and cumin, with basmati rice.,"toor dal,basmati rice,ghee,cumin,garlic,onion,tomato,turmeric,chili",Dairy
f17,Beef Burger & Fries,American,Dinner,680,32,70,30,Low,Non-Veg,350,Heavy,https://images.unsplash.com/photo-1568901346375-23c9450c58cd?w=600&h=400&fit=crop,Grilled beef patty with cheese, lettuce, pickles, and golden fries.,"beef patty,burger bun,cheddar cheese,lettuce,tomato,pickle,onion,potato,oil",Gluten|Dairy
f18,Veggie Quesadilla,Mexican,Snacks,290,10,32,12,Medium,Veg,190,Light,https://images.unsplash.com/photo-1618040996337-56904b7850b9?w=600&h=400&fit=crop,Toasted tortilla with melted cheese, corn, beans, and peppers.,"flour tortilla,cheddar cheese,corn,black beans,bell pepper,onion,cumin",Gluten|Dairy
f19,Grilled Salmon with Asparagus,American,Dinner,460,36,8,30,Low,Non-Veg,490,Light,https://images.unsplash.com/photo-1467003909585-2f8a72700288?w=600&h=400&fit=crop,Pan-seared salmon with lemon herb butter and grilled asparagus.,"salmon,asparagus,butter,lemon,garlic,dill,olive oil,salt,pepper",Fish|Dairy
f20,Miso Soup,Japanese,Breakfast,90,4,8,2,Low,Veg,110,Light,https://images.unsplash.com/photo-1547592166-23ac45744acd?w=600&h=400&fit=crop,Traditional Japanese soup with miso paste, tofu, and seaweed.,"miso paste,tofu,wakame seaweed,spring onion,dashi",Soy
f21,Chicken Ramen,Japanese,Dinner,540,28,62,16,Medium,Non-Veg,380,Heavy,https://images.unsplash.com/photo-1569718212165-3a8278d5f624?w=600&h=400&fit=crop,Rich chicken broth noodles with grilled chicken and soft boiled egg.,"ramen noodles,chicken,egg,spring onion,nori,soy sauce,miso,garlic,ginger",Gluten|Eggs|Soy
f22,Chicken Quesadilla,Mexican,Snacks,420,24,30,18,Medium,Non-Veg,240,Light,https://images.unsplash.com/photo-1628840042765-356cda07504e?w=600&h=400&fit=crop,Warm tortilla with melted cheese and spicy pulled chicken.,"flour tortilla,chicken,cheddar cheese,bell pepper,onion,cumin,chili",Gluten|Dairy
f23,Fruit Smoothie Bowl,American,Breakfast,240,5,48,4,Low,Veg,200,Light,https://images.unsplash.com/photo-1590301157890-4810ed352733?w=600&h=400&fit=crop,Blended banana-berry bowl topped with chia, granola, and honey.,"banana,strawberry,blueberry,chia seeds,granola,honey,almond milk",Nuts|Gluten
f24,Chocolate Pancake Stack,American,Breakfast,480,8,80,12,Low,Veg,180,Heavy,https://images.unsplash.com/photo-1567620905732-2d1ec7ab7445?w=600&h=400&fit=crop,Fluffy buttermilk pancakes with warm chocolate sauce.,"flour,buttermilk,egg,butter,chocolate,sugar,baking powder,vanilla",Gluten|Dairy|Eggs
f25,Quinoa Chickpea Salad,American,Lunch,290,10,40,8,Low,Veg,240,Light,https://images.unsplash.com/photo-1512621776951-a57141f2eefd?w=600&h=400&fit=crop,Quinoa, chickpeas, cucumber, and cherry tomatoes in lemon dressing.,"quinoa,chickpea,cucumber,cherry tomato,red onion,lemon,olive oil,parsley",
f26,Chili Con Carne,Mexican,Dinner,510,30,42,20,High,Non-Veg,320,Heavy,https://images.unsplash.com/photo-1455619452474-d2be8b1e70cd?w=600&h=400&fit=crop,Hearty stew of minced beef, kidney beans, chili peppers, and tomatoes.,"beef mince,kidney beans,tomato,onion,garlic,chili pepper,cumin,paprika,oil",
f27,Samosa,Indian,Snacks,190,3,24,10,High,Veg,40,Light,https://images.unsplash.com/photo-1601050690597-df0568f70950?w=600&h=400&fit=crop,Crispy fried pastry triangles filled with spiced potato and peas.,"flour,potato,peas,cumin,coriander,chili,oil,salt",Gluten
f28,Garlic Bread,Italian,Snacks,220,5,28,10,Low,Veg,140,Light,https://images.unsplash.com/photo-1619535860434-ba1d8fa12536?w=600&h=400&fit=crop,Toasted baguette with garlic butter, parsley, and melted mozzarella.,"baguette,butter,garlic,parsley,mozzarella",Gluten|Dairy
f29,Chicken Biryani,Indian,Dinner,590,32,68,18,High,Non-Veg,320,Heavy,https://images.unsplash.com/photo-1563379091339-03b21ab4a4f8?w=600&h=400&fit=crop,Layered basmati rice with chicken, whole spices, and saffron.,"basmati rice,chicken,onion,yogurt,saffron,bay leaf,cardamom,cinnamon,ghee,mint",Dairy
f30,Steamed Veg Momos,Chinese,Snacks,160,4,32,1,Medium,Veg,130,Light,https://images.unsplash.com/photo-1534422298391-e4f8c172dddb?w=600&h=400&fit=crop,Steamed dumplings stuffed with minced vegetables and sesame dipping sauce.,"flour,cabbage,carrot,spring onion,ginger,garlic,soy sauce,sesame oil",Gluten|Soy|Sesame
